{
  "$schema": "https://json-schema.org/draft/2020-12/schema",
  "$id": "https://notice2action.action4ai.internal/schemas/notice_output.schema.json",
  "title": "NoticeOutputSchema",
  "description": "Standardized schema contract for structured, evidence-linked extraction of official notices aligned with the Notice to Action PRD.",
  "type": "object",
  "required": [
    "category",
    "notice_title",
    "issuing_organisation",
    "affected_party",
    "main_purpose",
    "plain_language_summary",
    "deadlines",
    "required_documents",
    "submission_channel",
    "penalties",
    "action_steps",
    "warnings",
    "needs_verification"
  ],
  "properties": {
    "notice_id": {
      "type": "string",
      "description": "Unique identifier for the notice record or processing job."
    },
    "schema_version": {
      "type": "string",
      "default": "1.0",
      "description": "Version of this output schema contract."
    },
    "category": {
      "$ref": "#/$defs/CategoryEnum"
    },
    "notice_title": {
      "$ref": "#/$defs/EvidenceTextField",
      "description": "Official title or subject line of the notice."
    },
    "issuing_organisation": {
      "$ref": "#/$defs/EvidenceTextField",
      "description": "Issuing government department, municipal authority, university, or bank."
    },
    "affected_party": {
      "$ref": "#/$defs/EvidenceTextField",
      "description": "Designated audience, beneficiary group, or consumer affected by the notice."
    },
    "main_purpose": {
      "$ref": "#/$defs/EvidenceTextField",
      "description": "Primary goal or objective of the notice as stated in the text."
    },
    "plain_language_summary": {
      "type": "object",
      "description": "Deconstructed non-technical summary broken down into 5 key dimensions.",
      "required": [
        "what_is_this",
        "why_it_matters",
        "what_to_do",
        "where_to_do_it",
        "if_deadline_missed"
      ],
      "properties": {
        "what_is_this": {
          "oneOf": [
            { "$ref": "#/$defs/SummarySection" },
            { "type": "string" }
          ],
          "description": "Clear explanation of what document this is, or 'not_found'."
        },
        "why_it_matters": {
          "oneOf": [
            { "$ref": "#/$defs/SummarySection" },
            { "type": "string" }
          ],
          "description": "Why this notice is important to the recipient, or 'not_found'."
        },
        "what_to_do": {
          "oneOf": [
            { "$ref": "#/$defs/SummarySection" },
            { "type": "string" }
          ],
          "description": "Required actionable response, or 'not_found'."
        },
        "where_to_do_it": {
          "oneOf": [
            { "$ref": "#/$defs/SummarySection" },
            { "type": "string" }
          ],
          "description": "Location, portal, or counter to take action, or 'not_found'."
        },
        "if_deadline_missed": {
          "oneOf": [
            { "$ref": "#/$defs/SummarySection" },
            { "type": "string" }
          ],
          "description": "Consequences if deadline is missed, or 'not_found'."
        }
      },
      "additionalProperties": false
    },
    "deadlines": {
      "type": "array",
      "description": "List of explicit or relative deadlines identified in the notice.",
      "items": {
        "type": "object",
        "required": [
          "date",
          "description",
          "evidence_quote",
          "source_page",
          "confidence",
          "is_ambiguous_or_conflicting"
        ],
        "properties": {
          "date": {
            "type": ["string", "null"],
            "description": "Explicit due date (ISO string or raw date text) or 'not_found' / 'uncertain'."
          },
          "description": {
            "type": "string",
            "description": "Explanation of what must be submitted or performed by this deadline, or 'not_found' / 'uncertain'."
          },
          "evidence_quote": {
            "type": ["string", "null"],
            "description": "Verbatim quotation from the source text, or 'not_found' / 'uncertain'."
          },
          "source_page": {
            "oneOf": [
              { "type": "integer", "minimum": 1 },
              { "type": "string", "enum": ["not_found", "uncertain"] },
              { "type": "null" }
            ],
            "description": "1-indexed page number containing the deadline, or 'not_found' / 'uncertain' / null."
          },
          "confidence": {
            "oneOf": [
              { "type": "number", "minimum": 0.0, "maximum": 1.0 },
              { "type": "string", "enum": ["not_found", "uncertain"] }
            ],
            "description": "Extraction confidence score between 0.0 and 1.0, or 'not_found' / 'uncertain'."
          },
          "is_ambiguous_or_conflicting": {
            "type": "boolean",
            "description": "Flag set to true if date is ambiguous (e.g. relative without base date) or contradictory across sections (FR-04)."
          },
          "ambiguity_reason": {
            "type": ["string", "null"],
            "description": "Short explanation for why the deadline is marked ambiguous or conflicting."
          },
          "status": {
            "type": "string",
            "enum": ["found", "uncertain", "ambiguous", "conflicting", "not_found"],
            "description": "Deadline status indicator."
          }
        },
        "additionalProperties": false
      }
    },
    "required_documents": {
      "type": "array",
      "description": "Checklist of documents, certificates, or identity proofs mentioned in the notice.",
      "items": {
        "type": "object",
        "required": [
          "name",
          "is_required",
          "evidence_quote",
          "source_page",
          "status"
        ],
        "properties": {
          "name": {
            "type": "string",
            "description": "Document name or specification, or 'not_found' / 'uncertain'."
          },
          "is_required": {
            "type": "boolean",
            "description": "True if document is legally or procedurally mandatory; false if optional, recommended, or conditional."
          },
          "evidence_quote": {
            "type": ["string", "null"],
            "description": "Verbatim quote where this document is mentioned, or 'not_found' / 'uncertain'."
          },
          "source_page": {
            "oneOf": [
              { "type": "integer", "minimum": 1 },
              { "type": "string", "enum": ["not_found", "uncertain"] },
              { "type": "null" }
            ],
            "description": "1-indexed page number where document requirement appears, or 'not_found' / 'uncertain' / null."
          },
          "status": {
            "type": "string",
            "enum": ["not_completed", "completed", "needs_verification"],
            "description": "Current checklist status for the document."
          }
        },
        "additionalProperties": false
      }
    },
    "submission_channel": {
      "type": "object",
      "required": ["channel", "evidence_quote", "source_page"],
      "description": "Primary submission mode, portal URL, physical counter, or postal address.",
      "properties": {
        "channel": {
          "type": ["string", "null"],
          "description": "Submission portal URL, counter address, or email, or 'not_found' / 'uncertain'."
        },
        "evidence_quote": {
          "type": ["string", "null"],
          "description": "Verbatim quote indicating submission channel, or 'not_found' / 'uncertain'."
        },
        "source_page": {
          "oneOf": [
            { "type": "integer", "minimum": 1 },
            { "type": "string", "enum": ["not_found", "uncertain"] },
            { "type": "null" }
          ],
          "description": "1-indexed page number specifying the submission channel, or 'not_found' / 'uncertain' / null."
        },
        "status": {
          "type": "string",
          "enum": ["found", "uncertain", "not_found"],
          "description": "Verification status."
        }
      },
      "additionalProperties": false
    },
    "penalties": {
      "type": "array",
      "description": "Financial penalties, late fees, interest, or consequences specified in notice.",
      "items": {
        "type": "object",
        "required": ["description", "evidence_quote", "source_page"],
        "properties": {
          "description": {
            "type": "string",
            "description": "Description of penalty or consequence, or 'not_found' / 'uncertain'."
          },
          "amount": {
            "type": ["string", "number", "null"],
            "description": "Stated penalty amount or rate, or null / 'not_found' / 'uncertain'."
          },
          "evidence_quote": {
            "type": ["string", "null"],
            "description": "Verbatim quote describing the penalty, or 'not_found' / 'uncertain'."
          },
          "source_page": {
            "oneOf": [
              { "type": "integer", "minimum": 1 },
              { "type": "string", "enum": ["not_found", "uncertain"] },
              { "type": "null" }
            ],
            "description": "1-indexed page number describing penalty, or 'not_found' / 'uncertain' / null."
          },
          "status": {
            "type": "string",
            "enum": ["found", "uncertain", "not_found"],
            "description": "Verification status."
          }
        },
        "additionalProperties": false
      }
    },
    "action_steps": {
      "type": "array",
      "description": "Chronological ordered sequence of action steps for the recipient.",
      "items": {
        "type": "object",
        "required": ["order", "action", "evidence_quote", "source_page"],
        "properties": {
          "order": {
            "type": "integer",
            "minimum": 1,
            "description": "Sequential step number (1, 2, 3...)."
          },
          "action": {
            "type": "string",
            "description": "Direct, actionable instruction strictly derived from notice text, or 'not_found' / 'uncertain'."
          },
          "evidence_quote": {
            "type": ["string", "null"],
            "description": "Verbatim quote instructing this action, or 'not_found' / 'uncertain'."
          },
          "source_page": {
            "oneOf": [
              { "type": "integer", "minimum": 1 },
              { "type": "string", "enum": ["not_found", "uncertain"] },
              { "type": "null" }
            ],
            "description": "1-indexed page number containing the instruction, or 'not_found' / 'uncertain' / null."
          },
          "status": {
            "type": "string",
            "enum": ["found", "uncertain", "not_found"],
            "description": "Verification status."
          }
        },
        "additionalProperties": false
      }
    },
    "warnings": {
      "type": "array",
      "description": "Important conditions, cautions, or uncertainties noted in the notice.",
      "items": {
        "type": "object",
        "required": ["warning_text", "evidence_quote", "source_page"],
        "properties": {
          "warning_text": {
            "type": "string",
            "description": "Description of the warning, caution, or uncertainty condition."
          },
          "message": {
            "type": "string",
            "description": "Optional alias for warning_text."
          },
          "code": {
            "type": "string",
            "description": "Machine-readable warning code."
          },
          "severity": {
            "type": "string",
            "enum": ["info", "warning", "critical"]
          },
          "evidence_quote": {
            "type": ["string", "null"],
            "description": "Verbatim quote supporting the warning, or 'not_found' / 'uncertain' / null."
          },
          "source_page": {
            "oneOf": [
              { "type": "integer", "minimum": 1 },
              { "type": "string", "enum": ["not_found", "uncertain"] },
              { "type": "null" }
            ],
            "description": "1-indexed page number or null."
          }
        },
        "additionalProperties": false
      }
    },
    "needs_verification": {
      "type": "boolean",
      "description": "Overall flag set to true if any extracted item is uncertain, ambiguous, conflicting, or unverified."
    },
    "document_quality": {
      "type": "string",
      "enum": ["good", "poor_scan", "incomplete"],
      "description": "Assessment of input document readability."
    },
    "extracted_at": {
      "type": "string",
      "format": "date-time",
      "description": "ISO 8601 timestamp of extraction."
    }
  },
  "additionalProperties": false,
  "$defs": {
    "CategoryEnum": {
      "type": "string",
      "enum": [
        "scholarship_or_college",
        "bank",
        "utility",
        "tax_or_payment",
        "government_scheme",
        "other_out_of_scope"
      ],
      "description": "Canonical classification categories for official notices."
    },
    "EvidenceTextField": {
      "type": "object",
      "required": ["text", "evidence_quote", "source_page"],
      "properties": {
        "text": {
          "type": ["string", "null"],
          "description": "Extracted string content or 'not_found' / 'uncertain'."
        },
        "value": {
          "type": ["string", "null"],
          "description": "Optional alias for text."
        },
        "evidence_quote": {
          "type": ["string", "null"],
          "description": "Verbatim quote backing this field, or 'not_found' / 'uncertain'."
        },
        "source_page": {
          "oneOf": [
            { "type": "integer", "minimum": 1 },
            { "type": "string", "enum": ["not_found", "uncertain"] },
            { "type": "null" }
          ],
          "description": "1-indexed page number, or 'not_found' / 'uncertain' / null."
        },
        "status": {
          "type": "string",
          "enum": ["found", "uncertain", "not_found"]
        }
      },
      "additionalProperties": false
    },
    "SummarySection": {
      "type": "object",
      "required": ["text", "evidence_quote", "source_page"],
      "properties": {
        "text": {
          "type": ["string", "null"],
          "description": "Summary section text, or 'not_found' / 'uncertain'."
        },
        "evidence_quote": {
          "type": ["string", "null"],
          "description": "Verbatim quote or 'not_found' / 'uncertain'."
        },
        "source_page": {
          "oneOf": [
            { "type": "integer", "minimum": 1 },
            { "type": "string", "enum": ["not_found", "uncertain"] },
            { "type": "null" }
          ],
          "description": "1-indexed page number or 'not_found' / 'uncertain' / null."
        }
      },
      "additionalProperties": false
    }
  }
}
